keyword,title,text,topImage,date,author,description,keywords,_id
Donald Trump,How to Make Trump and the Wealthy Pay Their Taxes,"To revisit this article, select My Account, then View saved storiesTo revisit this article, visit My Profile, then View saved storiesBy John CassidySince a Democratic-controlled House Ways and Means Committee released five years of Donald Trump’s tax returns, the Republicans’ farcical struggle to elect a new Speaker of the House has distracted attention from two urgent questions that the contents of the returns raised: How can we remodel the U.S. tax system to prevent Trump and other wealthy tax cheats from continuing to make a mockery of it? And, going beyond the individual case, egregious as it is, how can we use what we have learned to make the tax system fairer?After reviewing years of Trump’s returns and speaking with independent tax experts, I am convinced that there are three imperatives. First, we need to strengthen the Internal Revenue Service so that it has the capacity to hold accountable serial tax avoiders like Trump and to deter would-be imitators. Second, we must eliminate loopholes in the tax code that serve no economic purpose beyond sheltering the riches of the financial élite while depriving the federal government of much-needed revenue that would aid other Americans. (This shortfall amounts to upward of four hundred billion dollars a year, according to some estimates.) Third, we have to introduce broader changes to the tax code for an economic era where the rich accumulate vast amounts of untaxed wealth, and where inequality has reached record levels.Trump’s returns, which cover the tax years 2015 through 2020 and run to thousands of pages, have added new details to a story that is, by now, well known. For more than three decades, he has flaunted his wealth while paying very little federal income tax, and in many years no tax at all. In 2017, his first year in the White House, Trump and his wife Melania paid seven hundred and fifty dollars in federal income tax, far less than the average school teacher. In 2020, Trump’s last year in office, he and his wife paid no federal income tax.How did he manage this? One thing that kept down Trump’s tax liabilities was the fact that, while he’s a natural at self-promotion and marketing, he’s a bad businessman. The returns confirm that some of his companies, particularly his chain of upscale golf resorts, suffer hefty operating losses year after year, and this offsets income from his licensing deals and other more profitable enterprises. To cite a recent example: in 2020, two golf courses that Trump owns in Scotland reported respective losses of $9.6 million and $2.6 million.But poor management is only part of the story. Trump also takes hefty deductions for depreciation of his real-estate assets, a tactic that many other property developers also exploit. And he doesn’t stop there. The returns show him claiming dubious charitable deductions and reporting business expenses that, in some cases, are suspiciously similar to the revenues these businesses took in, raising the question of whether these were genuine business expenses. For example, in 2016, one Trump entity, DT Endeavor I LLC (an aviation company), reported gross income of $680,886 and expenses that also somehow totalled exactly $680,886—a coincidence noted by the staff of the Joint Committee on Taxation in its report on the returns.Did the I.R.S. ask to see receipts for these expenses? We don’t know. We do know that, when the agency finally got around to auditing Trump’s returns in 2019, in all their length and complexity, it initially assigned the task to a single agent. We also know that, between 2010 and 2020, Congress reduced the I.R.S.’s budget by more than twenty per cent in inflation-adjusted terms, the number of people in the agency’s enforcement division fell by almost a third, and the rate at which rich taxpayers were audited dropped by more than two-thirds. “Rich, aggressive tax filers like Trump are playing an audit lottery, and they know they have little chance of getting caught,” Steven Rosenthal, a veteran tax lawyer who is now a senior fellow at the Urban-Brookings Tax Policy Center, told me. “The U.S. tax system relies on filers providing good-faith estimates of their taxable income. When you have bad-faith actors, that puts more pressure on the system. The I.R.S. needs more technical support, more lawyers to litigate cases, and more agents who understand complicated tax returns.”As part of last year’s Inflation Reduction Act, Congress took an important step toward reversing its past cuts, by allocating an additional eighty billion dollars to the I.R.S. About half of this sum will go to enforcement, particularly investigations of large corporations and high-net-worth individuals, like Trump. But House G.O.P. members, some of whom want to abolish the I.R.S. entirely, have already indicated their desire to rescind the additional funding. With Democrats controlling the Senate, that proposal has no chance of becoming law, but the threat from Republicans won’t end there. “When the debt ceiling comes up, they could hold up the entire country to reverse the eighty-billion-dollar increase,” Rosenthal warned.The first policy priority, then, is to insure that the additional resources for the I.R.S. remain in place, and that they get used wisely. But even a properly funded tax agency wouldn’t be able to prevent unscrupulous filers from exploiting every loophole in the tax code to the absolute maximum. Experts say the biggest reason that Trump has been able to avoid paying taxes for so long is three huge single-year losses, which he reported in the distant past: $916 million in 1995, nearly $700 million in 2009, and $200 million in 2010. Under the existing tax law, he has been able to carry these losses forward (and backward) to offset his tax liabilities in other, more profitable, years.Was this legitimate? At least in the earlier case, the I.R.S. appears to have accepted Trump’s huge loss carry-overs, or at least did not punish him. For the 2009 tax year and some subsequent ones, the agency audited Trump’s returns, and it’s not clear if these audits have been resolved. “Congress should investigate Trump’s huge operating losses and deductions,” Frank Clemente, the director of Americans for Tax Fairness, a Washington-based advocacy group, told me. “Is this something unique to Trump, or is this a loophole that others exploit, too, and which needs eliminating? Congress needs to find out. It shouldn’t be left to the I.R.S. to fight this out in court.”That brings us to the third imperative that I mentioned up top. If we want a better and more equitable tax system, we need to update the tax code for an economy that creates huge agglomerations of wealth, which a large industry of accountants and tax lawyers seeks to keep from the taxman’s grasp. Of course, progressive tax reform isn’t easy. If it were, abominations like the carried-interest deduction for managers of hedge funds and private-equity funds, which allows these people to shelter vast earnings, would have been expunged long ago. Still, there are a number of proposals already on the table that are worth pursuing, in whole or part.Reviving the effort to make wealth-fund managers pay their fair share would be a start. Another idea that shouldn’t be controversial is clamping down on the types of pass-through entities and private partnerships that feature prominently in Trump’s returns, and which can be used to avoid taxes and make it difficult for outsiders, including the I.R.S, to penetrate such financial thickets. The Democratic senator Ron Wyden has proposed draft legislation that limits the flexibility that these partnerships enjoy, and which would make it easier for the I.R.S to audit them effectively. That, surely, would be in the public interest.On a grander scale, President Biden last year proposed a “Billionaire Minimum Income Tax,” which would be tantamount to an annual wealth tax on some of the richest U.S. households. In addition to paying income tax on the income that they declare, households with a net worth of more than a hundred million dollars would be required to pay an annual levy on their unrealized capital gains. Although Biden’s proposal is less ambitious than the wealth-tax plans that Bernie Sanders and Elizabeth Warren unveiled during the 2020 Democratic Primary, its enactment would represent a landmark in U.S. tax policy.To be sure, with the Republicans controlling the House for the next two years, none of these proposals are likely to get far. But, in the spirit of trying to extract something positive from the Trump experience, it’s well worth developing them further and trying to build public support for them. And, while that’s happening, let’s not forget to strengthen the I.R.S. and protect it from renewed G.O.P. attacks. ♦A hookup app for the emotionally mature.A celebrity-divorce lawyer reflects on the state of marriage.Before my dad died, we went on vacation.A family heirloom from a university rec center.The repressive politics of emotional intelligence.Personal History by David Sedaris: after thirty years together, sleeping is the new having sex.Sign up for our daily newsletter to receive the best stories from The New Yorker.By signing up, you agree to our User Agreement and Privacy Policy & Cookie Statement.By The New YorkerBy Susan B. GlasserBy Joshua RothmanBy Nicole Rose WhitakerSectionsMore© 2023 Condé Nast. All rights reserved. Use of this site constitutes acceptance of our User Agreement and Privacy Policy and Cookie Statement and Your California Privacy Rights. The New Yorker may earn a portion of sales from products that are purchased through our site as part of our Affiliate Partnerships with retailers. The material on this site may not be reproduced, distributed, transmitted, cached or otherwise used, except with the prior written permission of Condé Nast. Ad Choices","https://media.newyorker.com/photos/63b848ec61bad1cfdf8f7f23/16:9/w_1280,c_limit/Cassidy-Taxation-Trump.jpg",2023-01-06T23:14:17.207Z,Condé Nast,Three core reforms would make the U.S. system eminently fairer for all Americans.,"['income taxes', 'donald trump', 'internal revenue service (i.r.s.)', 'income inequality', 'tax fraud', 'tax returns']",63ba9e5515657e93626052f1
Donald Trump,Joe Rogan said 'the morons had a king' with Donald Trump during a podcast episode,"Podcaster Joe Rogan said that ""the morons had a king"" with former President Donald Trump.Rogan commented on a Thursday episode of the Joe Rogan Experience podcast while speaking to Barstool Sports founder Dave Portnoy about politics.The pair discussed newly sworn-in Republican Rep. George Santos, who has generated controversy after reports revealed he fabricated vast swaths of his resume while campaigning.Rogan said there would be more candidates like Santos in the future and that politics is a ""gross, compromised world.""""I mean, who the fuck is gonna sign off on getting rid of all the special interest groups, getting rid of all the lobbyists? No one. So it's like, that's why it was fascinating to see a guy like Trump getting to power because he was such an outsider,"" Rogan said in a clip published by Mediaite.Portnoy agreed and said that the political establishment didn't know how to react to Trump as he behaved in a way they did not expect.""And the morons had a king. There's a lot of morons,"" Rogan said. ""And it doesn't matter what he's saying, like, for them, he represents them.""""'He's not perfect, but at least he's real' – like there's that sort of thought process that he played with,"" Rogan said while imitating a Trump supporter. ""And also people that didn't, they didn't feel represented by someone who was ever in charge. And now this guy is, and it's their guy."" Despite Rogan's popularity in right-wing circles, he has previously been dismissive of Trump and has claimed that he has turned down multiple requests for him to appear on his podcast.""I'm not a Trump supporter in any way, shape, or form. I've had the opportunity to have him on my show more than once. I've said no every time,"" Rogan said in July. ""I don't want to help him. I'm not interested in helping him.""Rogan has also expressed support for Trump's biggest rival, Florida Gov. Ron DeSantis, who he said would be a ""good president.""Trump has previously spoken positively of Rogan, calling him an ""interesting and popular guy"" and defending him following controversy about the podcast host's past use of the N-word.
                          Read next
                        ",https://i.insider.com/63b93db2d1c5130019f97ece?width=1200&format=jpeg,2023-01-07,Alia Shoaib,"""The morons had a king. There's a lot of morons,"" Joe Rogan said about Donald Trump and his supporters during a Thursday podcast episode.","['Joe Rogan', ' Joe Rogan Experience', ' Donald Trump', ' UK Weekend', ' News UK', ' Alia Shoaib']",63ba9e5615657e93626052f2
Donald Trump,Judge Rules for Justice Dept. in Dispute With Trump Over Documents Search,"AdvertisementSupported byThe court said the former president had to provide the government the names of private investigators he hired to search his properties last year for any classified material still in his possession.Send any friend a storyAs a subscriber, you have 10 gift articles to give each month. Anyone can read what you share.By Alan FeuerA federal judge has ordered lawyers for former President Donald J. Trump to give the government the names of the private investigators who searched Mr. Trump’s properties late last year for any remaining classified documents, part of what appeared to be a step by the Justice Department toward questioning the investigators about their efforts, two people familiar with the matter said.The order, issued on Wednesday by Beryl A. Howell, the chief judge of the Federal District Court in Washington, was the latest twist in a monthslong dispute between prosecutors and Mr. Trump’s lawyers about how forthcoming the former president has been in returning classified material that he removed from the White House after he left office. Hundreds of classified documents were later recovered by the government from Mar-a-Lago, Mr. Trump’s private club and residence in Florida.The fact that the Justice Department sought a formal order for the investigators’ names suggests an increasing breakdown in trust between prosecutors investigating the documents case and Mr. Trump’s legal team. And the request comes as a special counsel has taken over the inquiry into whether Mr. Trump willfully retained sensitive records or obstructed the government’s efforts to retrieve them.The New York Times reported in October that a top Justice Department official had told Mr. Trump’s legal team that the department believed the former president still had classified documents in his possession even after the F.B.I. conducted a search of Mar-a-Lago in August and hauled away more than 20 boxes of materials, including about 100 documents marked as classified.Around Thanksgiving, the private investigators hired by Mr. Trump conducted their own round of searches and found at least two additional documents bearing classification markings in a storage unit paid for by the federal General Services Administration in West Palm Beach, Fla., not far from Mar-a-Lago.The documents discovered at the storage facility were promptly returned to the government. But in a display of their lack of trust and their anger, prosecutors asked Judge Howell in sealed filings to hold representatives of Mr. Trump’s post-presidential office in contempt for having failed to fully comply with an initial subpoena — issued in May — demanding that he return all classified documents he took with him from the White House.At a court hearing held behind closed doors last month, Judge Howell put off ruling on the government’s contempt request. The judge has still not issued a decision, according to the people familiar with the matter.The more recent spat began when prosecutors asked Mr. Trump’s lawyers for the names of the investigators who searched the storage facility and other Trump properties — among them, Mar-a-Lago; Mr. Trump’s golf club in Bedminster, N.J.; and Trump Tower in New York.According to the people familiar with the matter, the lawyers offered to make the investigators available for questioning but wanted their identities shielded by a protective order, out of concern that the government might leak the information to the news media.Instead of agreeing to a protective order, one of the people said, prosecutors asked Judge Howell for a motion to compel the release of the investigators’ names. A spokesman for the office of Jack Smith, the special counsel who is overseeing the documents inquiry, did not immediately respond to a message seeking comment.If the private investigators are ultimately interviewed by prosecutors or are put in front of a federal grand jury in Washington that is investigating the handling of the documents, they will join a growing number of people close to Mr. Trump who have been questioned in connection with the case.Prosecutors have interviewed Walt Nauta, who worked in the White House as a military valet and cook when Mr. Trump was president and later for him personally at Mar-a-Lago. Prosecutors have indicated they are skeptical of an initial account that Mr. Nauta gave about moving documents stored at Mar-a-Lago and have been using the specter of charges against him to persuade him to cooperate with the inquiry.Prosecutors have also conferred immunity on Kash Patel, a former close adviser to Mr. Trump, effectively forcing him to testify in the documents investigation in front of the grand jury. Mr. Patel had initially invoked his Fifth Amendment rights against self-incrimination and refused to answer questions from prosecutors investigating Mr. Trump.Advertisement",https://static01.nyt.com/images/2023/01/05/multimedia/05dc-documents-1-6902/05dc-documents-1-6902-facebookJumbo.jpg,2023-01-05T22:22:52.000Z,,The court said the former president had to provide the government the names of private investigators he hired to search his properties last year for any classified material still in his possession.,"['Classified Information', 'FBI', 'Justice Department', 'Mar-a-Lago', 'Trump Tower', 'Donald Trump', 'Jack Smith', 'Beryl Howell']",63ba9e5815657e93626052f3
