keyword,title,text,topImage,date,author,description,keywords,_id
Donald Trump,"Two years after US Capitol attack, investigation into Trump and insurrection enters new phase | CNN Politics","
      Two years after rioters stormed the US Capitol, the Justice Department’s sprawling criminal investigation into the effort to block the peaceful transition of power enters a new phase with the special counsel adding two right-hand prosecutors to an experienced team that will ultimately determine whether former President Donald Trump or his allies should face prosecution.  
  
      Special counsel Jack Smith has returned to the US after spending the past month working remotely in Europe while recovering from a bicycle accident.  
  
      He is adding two longtime associates who have specialized in public corruption cases, according to a person familiar with the matter: Raymond Hulser, the former chief of the DOJ’s public integrity section, and David Harbach, who conducted cases against former Sen. John Edwards and Virginia Gov. Bob McDonnell. 
  
      
      Newly appointed special counsel Jack Smith is moving fast on a pair of criminal investigations around Donald Trump
    
      The expansion under Smith shores up the office’s ability to examine broad conspiracy cases and determine the avenues of the investigation, another source said. They join a team of more than 20 prosecutors from DOJ, as well as senior advisers brought into the department in recent months, who were already investigating Trump and his allies.
  
      Despite Attorney General Merrick Garland’s assurances that Smith’s appointment won’t slow down the dual Trump-related probes, setting his office up does take time. Smith’s team is still working to find a permanent physical office location but has begun changing over email addresses for staffers who had previously been using their usual Justice Department accounts.   
  
      Harbach was seen by CNN getting his bearings in the federal courthouse in DC on Thursday, speaking to another special counsel prosecutor about extremist group cases and briefly sitting in on an ongoing Oath Keepers seditious conspiracy trial.
  
      According to the Justice Department, more than 950 defendants have been arrested for their alleged participation in the January 6, 2021, riot, with more than 500 being found guilty. Four people died in the attack, including rioter Ashli Babbitt who was shot by a Capitol police officer, two members of the crowd who suffered heart attacks, and one who died of an overdose. DOJ says 140 officers were injured that day and five officers died in the months after the riot – one of strokes and four by suicide.  
  
      
      Trump accused in lawsuit of causing wrongful death of Officer Brian Sicknick in US Capitol attack
    
      Smith and his new team have inherited the January 6 probe at a crucial juncture, as the public has a better understanding of the lengths the former president and his allies went to try to keep Trump in the Oval Office but also as congressional investigators hit the limits of their powers.   
  
      And where the House select committee hit brick walls in its probe – including with recalcitrant witnesses who claimed privileges, or, like Mark Meadows, bailed on cooperating with congressional investigators midway through – DOJ prosecutors now working under Smith will have certain tools to dismantle those barriers. They include ongoing legal proceedings about piercing the shield of confidentially that normally surrounds a president.                                                                                                                 
  
      The special counsel also has a massive amount of evidence already in-hand that it now needs to comb through, including evidence recently turned over by the House January 6 committee, subpoena documents provided by local officials in key states and discovery collected from lawyers for Trump allies late last year in a flurry of activity, at least some of which has not even been reviewed yet, according to sources familiar with the investigation. 
  
      Smith himself sent subpoenas to election officials in seven battleground states and received a trove of material. Included in the response from Michigan’s secretary of state is an email from a county official who was reporting two voicemails they received in December 2020 from individuals seeking access to voting equipment. One call came from someone claiming to work for Trump’s post-election legal team, the clerk wrote. 
  
      As Trump’s direct involvement in efforts to block the certification of the 2020 election becomes clearer, so too do the hurdles investigators may face if they try to build a case against the former president.     
  
      “They may get to the colonels, but they may not get to the general,” Michael Moore, a US attorney during the Obama administration, told CNN. 
  
      Witness emails, text messages and testimony from the House January 6 committee show Trump’s role in pushing alternate slates of electors, pressing battleground state officials to overturn the election results, attempting to replace the acting attorney general with someone who would embrace election fraud claims and laying the groundwork early on to call his followers to the Capitol.   
  
      
      'This made us all unemployable': Trump White House aides respond to January 6 in angry text exchange
    
      “POTUS expectations are to have something intimate at the ellipse, and call on everyone to march to the capitol,” rally organizer Katrina Pierson wrote in an email days before the Capitol attack.   
  
      But interview transcripts released by the committee also reveal gaps that could stymy federal investigators, witnesses with faltering memories and testimony about Trump’s tech-avoidance. 
  
      “My father doesn’t use text messaging or email,” Donald Trump Jr. told congressional investigators during his interview. As for other messaging apps, “I’m not sure he’d even know what they were,” Trump Jr. said.  
  
      Trump’s style of making ambiguous asks rather than direct demands was also on display as he pressed state officials to upend the election results. “One thing I do remember is that he never, ever, to the best of my recollection, ever made a specific ask,” said Michigan’s former Senate Majority Leader Mike Shirkey. “It was always just general topics.”  
  
      The committee’s investigation has given a fuller and more nuanced picture of the interconnected plots that the DOJ has been investigating, including a scheme to put forward slates of illegitimate Trump electors from battleground states that Biden won to pressure then-Vice President Mike Pence and Congress to halt the certification of the results.  
  
      Campaign staff testified that Trump was behind the drive to carry out the maneuver, and the panel collected other evidence that Trump was in the loop about its operation – including with a phone call to RNC Chairwoman Ronna McDaniel.     
  
      According to the evidence collected by the committee, many of the state-based operatives and fraudulent electors themselves were largely in the dark about what the endgame of the gambit was. Several of them testified that they were under the impression alternate electors were being assembled as a contingency plan in case Trump prevailed in a legal challenge that changed the result in their state.    
  
      Meanwhile, top Trump campaign officials distanced themselves from the effort after the last prominent election challenge – a far-fetched petition at the Supreme Court – petered out on December 11, 2020.   
  
      For those who continued working on the scheme with Congress’ certification in mind, “DOJ would have a much easier case to prove,” said Ryan Goodman, a New York University School of Law professor and former Department of Defense general counsel.   
  
      The committee has assembled evidence that a group of Trump legal advisers – and namely, ex-Wisconsin state Judge Jim Troupis and lawyer Kenneth Chesebro – were looking at Congress’s certification as they put the fake electors plan in motion.    
  
      A memo outlining the plan on December 9 suggests those advisers saw the alternate electors crucial not only in the event of a court ruling that reversed Trump’s electoral loss, but if a “state legislature” or “Congress” deemed the Trump electors as the valid ones.   
  
      Trump and his allies could face additional criminal exposure, beyond the DOJ probe as prosecutors in Georgia are also investigating efforts to overturn the presidential election results there. The Atlanta-area district attorney leading that probe, Fani Willis, has labeled the individuals who served as pro-Trump electors from Georgia are “targets” in her investigation, along with some notable Trump allies like Rudy Giuliani. 
  
      While the committee made the historic move of referring Trump to the Justice Department for criminal prosecution, it also named several Trump allies as potential co-conspirators in its final report. One of them was former White House chief of staff Mark Meadows.   
  
      “It was pretty obvious that the ex-president was the center of this conspiracy, but he was certainly assisted by many others, including … Mark Meadows and the like,” said Rep. Zoe Lofgren, a California Democrat who served on the committee.   
  
      Meadows repeatedly comes up in the committee’s investigation, with evidence showing his involvement on some level in every gambit to overturn the election. Some of the most revelatory evidence came from Meadows himself – in the thousands of text messages he turned over to the committee before ceasing his cooperation with the investigation.   
  
      The texts show that beginning on Election Day, Meadows was connecting activists pushing conspiracy theories and strategizing with GOP lawmakers and rally organizers preparing for January 6. Two days after the election, Trump Jr. was texting Meadows with ideas for keeping his father in power that he thought were “the most sophisticated” and “sounded plausible.”  
  
      Meadows and Giuliani, Trump’s one-time attorney, were involved in early conversations about putting forward fake slates of electors, according to testimony that former White House aide Cassidy Hutchinson gave to the committee. 
  
      Transcripts released by the committee also reveal that Hutchinson testified before the committee how Meadows regularly burned documents in his fireplace around a dozen times – about once or twice a week – between December 2020 and mid-January 2021.   
  
      After producing the texts to congressional investigators, Meadows changed gears and did not show up for subpoenaed testimony before the House. A lawsuit he filed challenging the subpoena was unsuccessful, but the Justice Department opted not to bring criminal charges for his lack of cooperation. 
  
      The committee noted in their report’s summary that criminal prosecutors may have access to materials that lawmakers didn’t have, pointing to Meadows specifically.   
  
      “Indeed, both the Department of Justice and the Fulton County District Attorney may now have access to witness testimony and records that have been unavailable to the Committee, including testimony from President Trump’s Chief of Staff Mark Meadows, and others who either asserted privileges or invoked their Fifth Amendment rights,” the summary said. 
  
      “When it comes to the President, he committed no crime so there should absolutely be no prosecutions related to him,” said Timothy Parlatore, one of Trump’s attorneys. 
  
      Parlatore insisted Trump and his team “were not looking to overturn the will of the people, only to ensure that the will of the people was accurately counted,” adding that Trump was “absolutely opposed” to the violence that took place at the US Capitol. 
  
      Meadows’ attorney declined to comment.
  
  CNN’s Casey Gannon, Evan Perez , Holmes Lybrand and Hannah Rabinowitz contributed to this report.
© 2022 Cable News Network. A Warner Bros. Discovery Company. All Rights Reserved.  CNN Sans ™ & © 2016 Cable News Network.","https://media.cnn.com/api/v1/images/stellar/prod/230105141948-trump-smith-split.jpg?c=16x9&q=w_800,c_fill",2023-01-06T10:05:46Z,"Zachary Cohen,Katelyn Polantz,Tierney Sneed,Sara Murray,Paula Reid",,"['brand safety-nsf crime', ' brand safety-nsf other', ' brand safety-nsf sensitive', ' brand safety-nsf terrorism', ' brand safety-nsf violence', ' brand safety-nsf war and military', ' buildings and structures', ' civil disobedience', ' continents and regions', ' coups and attempted coups', ' crime', ' law enforcement and corrections', ' criminal law', ' domestic alerts', ' domestic terrorism', ' domestic-us news', ' domestic-us politics', ' donald trump', ' donald trump', ' jr.', ' elections and campaigns', ' government and public administration', ' government bodies and offices', ' government departments and authorities', ' government organizations - us', ' iab-crime', ' iab-elections', ' iab-law', ' iab-politics', ' iab-war and conflicts', ' international alerts', ' international relations and national security', ' international-us news', ' international-us politics', ' investigations', ' jack smith (lawyer)', ' justice departments', ' law and legal system', ' mark meadows', ' national security', ' north america', ' points of interest', ' political figures - us', ' politics', ' protests and demonstrations', ' riots', ' societal issues', ' society', ' terrorism', ' terrorism and counter-terrorism', ' testimony', ' the americas', ' trial and procedure', ' trump document investigation', ' united states', ' unrest', ' conflicts and war', ' us capitol building', ' us capitol insurrection', ' us congress', ' us department of justice', ' us federal departments and agencies', ' us federal government', ' violence in society', ' white house']",63ba9e5a15657e93626052f4
Donald Trump,Trump Is Already Facing a Lawsuit to Stop His 2024 Campaign,"Insight and analysis of top stories from our award winning magazine ""Bloomberg Businessweek"".This QuickTake adaptation of our award-winning podcast, The Pay Check, focuses on the racial wealth gap.Europe Inflation Barb Gives New Year Bond Fizz a Bitter TasteAlibaba Plans Logistics Hub at Istanbul Airport, Data Center Near AnkaraChina Central Bank Official Says Growth to Be Back on Track SoonUS CPI Will Help Determine Size of Next Fed Rate Hike: Eco Week AheadRisk Is Inflation Not Falling Back to 2%, Says Fidelity’s TimmerMcDonald’s Quickens New Store Growth While Also Cutting JobsBillionaire Jack Ma Is Giving Up Control of Ant GroupTwitter Cuts More Staff Overseeing Global Content ModerationVietnam EV Maker VinFast Delays First US Car Deliveries to Jan.Seattle Schools Sue Big Tech Over Youth Mental Health CrisisPutin’s Energy Gambit Fizzles as Warm Winter Saves EuropeIranian Arrested in Germany, Suspected of Chemical Attack PlotDamar Hamlin’s Toy Drive Gets $85,000 Fantasy Football BoostJack Ma Is Spotted in Thailand in a Rare Public AppearancePublic Now Can See Benedict's Tomb at St. Peter's BasilicaTravelers Rush to Take Advantage of China ReopeningWant to Avoid Death? Maybe Cryonics Isn't CrazyAmerican and British Conservatives Are Frozen in FailureWhose Fault Is It If You Don't Like Numbers?Silicon Valley Can’t Quit Its Pizza Robot ObsessionMarkets: Don’t Look BackThe World’s Love Affair With Japanese Cars Is SouringWorld’s First MeToo Official Finds a Tougher Job Than She ExpectedLast Year Was Deadliest Year on Record for Police Violence in the USThe Kitchen Larder Is Making a ComebackSan Francisco Is in Path of California’s Worst Rainstorm YetVancouver Skyscraper Twists Around Zoning RestrictionsNYC Subway Crime Jumps 30%, Defying Surge in Police PatrolsExtreme Acceleration Is the New Traffic Safety Frontier‘Spectacular’ Trading Drop Plagues Still-Reeling Crypto MarketFTX’s Sam Bankman-Fried Pleads Not Guilty. Now What? (Podcast)Digital Currency Group Closes Wealth Division Amid TroubleZoe TillmanSubscriber BenefitSubscribeSign InDonald Trump is facing the first legal challenge to his eligibility to run for president in 2024 since declaring his candidacy, only weeks after a congressional committee investigating the US Capitol attack suggested he be disqualified from ever holding office again.The lawsuit was filed Friday in federal court in Florida by John Anthony Castro, an attorney in Texas. Castro, like the former president, is seeking the Republican nomination for 2024 and has registered his campaign with the Federal Election Commission. He’s asking a judge to declare Trump constitutionally ineligible to hold office and to order a halt to any campaigning and fundraising.",https://assets.bwbx.io/images/users/iqjWHBFdfxIU/iD8LpNA4j61k/v0/1200x800.jpg,2023-01-06T20:55:48.193Z,,"Donald Trump is facing the first legal challenge to his eligibility to run for president in 2024 since declaring his candidacy, only weeks after a congressional committee investigating the US Capitol attack suggested he be disqualified from ever holding office again.","['Donald John Trump', 'Florida', 'Texas', 'U.S. Republicans', 'Law', 'West Palm Beach', 'South Florida', 'Justice Department', 'Politics', 'politics']",63ba9e5d15657e93626052f5
Donald Trump,"“He Was All In”: Donald Trump’s Influence Over Congress Remains A Force To Be Reckoned With, Even If Waning","To revist this article, visit My Profile, then View saved stories.To revist this article, visit My Profile, then View saved stories.By Kelly RissmanTwo years after former President Donald Trump’s supporters stormed the Capitol on January 6 to stop the election certification of Joe Biden, Congress is still in chaos as his presence haunts the House chamber and continues to fracture the Republican party.Although a group of Republicans refused to back Trump’s pick for speaker, Kevin McCarthy, last night gave new life to the former president, thanking the former president even though he did not provide any additional votes for McCarthy. After McCarthy won the race for House Speaker—after four days and 15 rounds of voting—he gave credit to Trump: “But I do want to especially thank President Trump. I don’t think anybody should doubt his influence. He was with me from the beginning,” McCarthy told reporters after a dragged-out path to victory. “He was with me from the beginning — somebody wrote the doubt of whether he was there — and he was all in,” McCarthy added. “He would call me, and he would call others. And he really was — I was just talking to him tonight — helping get those final votes.”This content can also be viewed on the site it originates from.The lack of unwavering loyalty to Trump’s pleas exemplifies Trump’s waning influence in the party, while McCarthy’s display of gratitude underscores the hold the former president still has on many Republicans in Congress. Rep. Lauren Boebert (R-Colo.) said that Trump had spoken to her and other rebels “to tell us to knock this off."" Still, they did not relent. On Thursday, Rep. Ryan Zinke (R-Mont.), a McCarthy ally and former Secretary of the Interior for Trump, said Trump’s influence is “absolutely” waning.But the New York Times reported that Trump called Reps. Matt Gaetz (R-Fla.) and Andy Biggs (R-Ariz.)—two of the “Never Kevins”—on Friday, likely encouraging them to switch their final votes from anti-McCarthy to “present,” which gave McCarthy the necessary votes to win.The former president was an outspoken advocate for McCarthy, often writing in support of him on Truth Social, Trump’s social platform.Earlier this week, Trump wrote: “Some really good conversations took place last night, and it’s now time for all of our GREAT Republican House Members to VOTE FOR KEVIN, CLOSE THE DEAL, TAKE THE VICTORY…DO NOT TURN A GREAT TRIUMPH INTO A GIANT & EMBARRASSING DEFEAT. IT’S TIME TO CELEBRATE, YOU DESERVE IT. Kevin McCarthy will do a good job, and maybe even a GREAT JOB - JUST WATCH!”In a viral photo, Rep. Marjorie Taylor Greene (R-Ga.) was captured in the chamber holding up her phone, displaying the initials “DT,” ostensibly speaking to the former president shortly after McCarthy earned enough votes. By Joe PompeoBy Emily KirkpatrickBy Kenzie BryantThis content can also be viewed on the site it originates from.Trump announced his White House run in November, though it’s unclear how much support he will have from Republicans, especially in the wake of the new session’s disarray.A Comprehensive Guide to Why a Ron DeSantis Presidency Would Be as Terrifying as a Trump OnePalace Insiders Say Prince William Is Already Furious About Prince Harry’s Memoir“No Willingness to Reconcile”: Prince Harry Wants His Brother and Father BackThe 45 TV Shows You Should Be Excited About in 2023The 26 Most Anticipated Movies of 2023Billy McFarland Is Sorry—Really. He’s Also Got a New Pitch for YouHow Evangelicals Are Quietly Ditching Donald Trump’s 2024 Bid Kate Hudson and Janelle Monáe Go Toe-to-Toe in VF’s Lie Detector TestFrom the Archive: Pope Versus Pope (2018)By Eric LutzBy Tara GolshanBy Eric LutzBy Eric LutzMore from Vanity FairContact© 2023 Condé Nast. All rights reserved. Use of this site constitutes acceptance of our User Agreement and Privacy Policy and Cookie Statement and Your California Privacy Rights. Vanity Fair may earn a portion of sales from products that are purchased through our site as part of our Affiliate Partnerships with retailers. The material on this site may not be reproduced, distributed, transmitted, cached or otherwise used, except with the prior written permission of Condé Nast. Ad ChoicesCN Entertainment","https://media.vanityfair.com/photos/63b9b5ea9bf0cb1ae57daa86/16:9/w_1280,c_limit/1201947796",2023-01-07T18:29:06.217Z,Condé Nast,Speaker Kevin McCarthy thanked Donald Trump for his help after winning a slim victory after 15 attempts.,[''],63ba9e5f15657e93626052f6
