keyword,title,text,topImage,date,author,description,keywords,_id
Donald Trump,Analysis: Dana Bash reacts to McCarthy thanking Trump for speaker role | CNN Politics,© 2022 Cable News Network. A Warner Bros. Discovery Company. All Rights Reserved.  CNN Sans ™ & © 2016 Cable News Network.,"https://media.cnn.com/api/v1/images/stellar/prod/210715143010-trump-mccarthy-split.jpg?q=x_0,y_0,h_619,w_1100,c_fill/w_800",2023-01-07T12:46:12Z,,,"['dana bash', ' domestic alerts', ' domestic-us politics', ' donald trump', ' government and public administration', ' government bodies and offices', ' government organizations - us', ' iab-politics', ' international alerts', ' international-us politics', ' kevin mccarthy', ' misc people', ' phil mattingly', ' political figures - us', ' politics', ' us congress', ' us federal government', ' us house of representatives', ' white house']",63ba9e4715657e93626052ed
Donald Trump,Trump’s Troubles Mount as Special Counsel Gets New 2020 Evidence,"Insight and analysis of top stories from our award winning magazine ""Bloomberg Businessweek"".This QuickTake adaptation of our award-winning podcast, The Pay Check, focuses on the racial wealth gap.Europe Inflation Barb Gives New Year Bond Fizz a Bitter TasteAlibaba Plans Logistics Hub at Istanbul Airport, Data Center Near AnkaraChina Central Bank Official Says Growth to Be Back on Track SoonUS CPI Will Help Determine Size of Next Fed Rate Hike: Eco Week AheadRisk Is Inflation Not Falling Back to 2%, Says Fidelity’s TimmerMcDonald’s Quickens New Store Growth While Also Cutting JobsBillionaire Jack Ma Is Giving Up Control of Ant GroupTwitter Cuts More Staff Overseeing Global Content ModerationVietnam EV Maker VinFast Delays First US Car Deliveries to Jan.Seattle Schools Sue Big Tech Over Youth Mental Health CrisisPutin’s Energy Gambit Fizzles as Warm Winter Saves EuropeIranian Arrested in Germany, Suspected of Chemical Attack PlotDamar Hamlin’s Toy Drive Gets $85,000 Fantasy Football BoostJack Ma Is Spotted in Thailand in a Rare Public AppearancePublic Now Can See Benedict's Tomb at St. Peter's BasilicaTravelers Rush to Take Advantage of China ReopeningWant to Avoid Death? Maybe Cryonics Isn't CrazyAmerican and British Conservatives Are Frozen in FailureWhose Fault Is It If You Don't Like Numbers?Silicon Valley Can’t Quit Its Pizza Robot ObsessionMarkets: Don’t Look BackThe World’s Love Affair With Japanese Cars Is SouringWorld’s First MeToo Official Finds a Tougher Job Than She ExpectedLast Year Was Deadliest Year on Record for Police Violence in the USThe Kitchen Larder Is Making a ComebackSan Francisco Is in Path of California’s Worst Rainstorm YetVancouver Skyscraper Twists Around Zoning RestrictionsNYC Subway Crime Jumps 30%, Defying Surge in Police PatrolsExtreme Acceleration Is the New Traffic Safety Frontier‘Spectacular’ Trading Drop Plagues Still-Reeling Crypto MarketFTX’s Sam Bankman-Fried Pleads Not Guilty. Now What? (Podcast)Digital Currency Group Closes Wealth Division Amid TroubleChris Strohm and Zoe TillmanSubscriber BenefitSubscribeSign InThe special counsel investigating Donald Trump has new emails, letters and other documents from election officials in battleground states, as the federal probe accelerates into whether the former president should face criminal charges for efforts to overturn the 2020 election.Two years after the US Capitol attack and with the 2024 election cycle looming, Special Counsel Jack Smith and his team of Justice Department prosecutors are combing through new testimony and evidence. He’s set to make critical decisions about whether to bring charges, possibly in a matter of weeks, according to people familiar with the matter.",https://assets.bwbx.io/images/users/iqjWHBFdfxIU/i9tl8vsJqUL8/v1/1200x753.jpg,2023-01-05T16:12:10.069Z,,"The special counsel investigating Donald Trump has new emails, letters and other documents from election officials in battleground states, as the federal probe accelerates into whether the former president should face criminal charges for efforts to overturn the 2020 election.","['Donald John Trump', 'Federal Bureau of Investigation', 'Justice Department', 'Nevada', 'U.S. Republicans', 'Brian F Kidd', 'Government', 'Washington', 'White House', 'Joe Biden', 'politics']",63ba9e4a15657e93626052ee
Donald Trump,Opinion | The Party of One Becomes the Party of None,"
POLITICS
The GOP is shrugging off its subservience to Trump, but with no one left to fill the void.
Reps. Chip Roy, Byron Donalds and Matt Gaetz take part in the fourth day of the House speakership election at the U.S. Capitol on Jan. 6, 2023. | Francis Chung/POLITICO
Opinion by Bill Scher
01/07/2023 09:25 AM EST
Link CopiedBill Scher is a contributing writer to Politico Magazine and a contributor to RealClearPolitics as well as co-host of “The DMZ,” an online show and podcast with conservative writer Matt Lewis.“This is not a Republican Party anymore. It’s a cult,” former Republican Sen. Alan Simpson said last year. He was far from alone. Ever since Donald Trump blustered his way through the 2016 Republican primary and general election — trampling over long-cherished conservative principles, viciously mocking any less-than-perfectly-loyal party members and boasting he could commit murder in broad daylight without losing supporters — the Cult of Trump image has sullied the Grand Old Party. Yet, in the speaker fight that consumed the House this past week, some Trump supporters put down their cups of Kool-Aid. The embattled Rep. Kevin McCarthy was endorsed by Trump, yet McCarthy’s loudest holdouts were Trump supporters. One of them, Rep. Lauren Boebert, audaciously and publicly admonished Trump on the House floor to “tell Kevin McCarthy that, ‘Sir, you do not have the votes and it’s time to withdraw.’” Rep. Matt Gaetz, on Fox News Thursday night, while professing his “love” for Trump, said the former president “is wrong to the extent that he supports Kevin McCarthy,” cheekily noting that “H.R. wasn’t always his strong suit.”Trump’s Wednesday endorsement failed to immediately flip any of the 20 Republicans who had previously rejected McCarthy (one additional Republican voted “present” soon after the endorsement). But that’s only the most recent exhortation from Trump that was ignored by congressional Republicans. Two weeks earlier, Trump instructed “every single Republican” to “vote no on the ludicrous, unacceptable $1.7 trillion omnibus spending bill. It’s a disaster for our country, and it also happens to be a disaster for the Republican Party, because they could stop it.” Yet 18 Senate Republicans, including Minority Leader Mitch McConnell, gave the package a filibuster-proof supermajority, smoothing its path to the president’s desk. (McCarthy and nearly all House Republicans opposed it, but McCarthy’s Republican critics claimed he didn’t fight it hard enough). in other words, Trump’s appeals have been ignored by both center-right senators and far-right House members.McConnell is a card-carrying member of the Republican establishment and has been shrugging off Trump’s criticisms of his bipartisan dealmaking over the last two years. Hard-liners like Boebert and Gaetz, on the other hand, have long been close to Trump substantively and stylistically. If they are no longer under Trump’s spell, then nobody in Congress is.And why should they be? Trump’s fearsome powers are no more. He had enough intra-party power in 2022 to engineer primary victories for most of his preferred candidates, and defeat several House Republicans who voted for impeachment. Yet he couldn’t dislodge the Republican governor and secretary of state of Georgia after (falsely) accusing them of abetting a rigged 2020 election. And his slate failed in the general election to win back the Senate for the GOP. Republican voters appeared to have noticed his diminished standing; over the course of the year, Trump lost significant ground to Florida Gov. Ron DeSantis in 2024 presidential primary polls.The end of Trump’s vise grip on the Republican Party should be a healthy development, except for one problem: Instead being a Party of One, they are presently a Party of None. No leaders. No shared principles. No consensus on policy objectives.A temporary period of leaderless soul-searching is not unusual or unhealthy for a party that lost a presidential election. Subsequent presidential primaries are a fine way to resolve internal debates, allowing the next standard bearer to chart the party’s course.However, America today doesn’t have the luxury of waiting for the Republican Party to get its act together. Voters just gave Republicans the keys to the House, and we need them — at minimum — to keep the government open, meet our debt obligations and avoid a global economic meltdown. Typically, these basic functions aren’t hard asks. But they may be too much for a Party of None to manage.While Trump may no longer be the heart of the GOP, his scar tissue remains. By constantly waging war on imperfectly loyal party members, Trump effectively repealed Ronald Reagan’s 11th Commandment, “Thou shalt not speak ill of another Republican.” By promoting a diplomatic thaw with Russia, Trump emboldened far-right neo-isolationists critical of the Ukrainian resistance, and threatened the year-long streak of bipartisan support for Ukraine aid. By recklessly instigating his own government shutdown as president, Trump whetted the appetite of Freedom Caucus members who appear eager to not only take the debt limit hostage but, for the first time, shoot it dead.All of these marks that Trump left on the Republican Party drove the resistance to McCarthy. Gaetz and Boebert suggested the protracted speaker fight was stopping the flow of funds to Ukraine. Rep. Ralph Norman said Wednesday he wants the next speaker to be “willing to shut the government down rather than raising the debt ceiling” (though the next day he partially walked the comment back and voted for McCarthy on Friday.).Most fundamentally, the right-wing dissidents — akin to the left-wing Occupy Wall Street protesters of 2011 — reject the basic concept of hierarchical leadership. Rep. Byron Donalds, who briefly ran against McCarthy, said individual House members should have the power to force floor votes that can fire a speaker, because he doesn’t want “more power into the hands of the speakership.” Boebert similarly told Fox News’ Sean Hannity, “We need a check and a balance on the third [sic] in line to the presidency.”Late into the night on Friday, McCarty finally flipped enough of the holdouts to win — not because of Trump’s endorsement, but because of a slew of concessions, including the rule change making it easier to oust the speaker. Gaetz boasted Thursday night that even if McCarthy managed to win, “he will have to live the entirety of his speakership in a straitjacket constructed by these rules that we’re working on now.” Just two years ago, House Republicans lived in fear of their party’s president. Today, they are building a House where the speaker must live in fear of his party’s members.Granted, the House Republican Conference has been unruly at times before Trump came along. Newt Gingrich’s speakership was wounded by an aborted 1997 coup attempt, hatched mainly by frustrated conservatives, before being put out of its misery after Republicans lost House seats in the 1998 midterm. In 2015, John Boehner, in defiance of Freedom Caucus demands, kept the government open mainly with Democratic votes. Then he quit before he could be fired.But today’s nihilistic Republicans, influenced by Trump’s limitless capacity for conflict, are going to historic lengths to strip the speaker position of power before the first bang of the gavel in the 118th Congress. What had been a cult is rapidly transforming into a state of anarchy.Of course, states of anarchy don’t last. Power fills voids. The Freedom Caucus is making enormous strides in filling that void. Even though McCarthy survived, as Gaetz noted, a set of rules and committee assignments was negotiated by the Republican factions that would allow the far-right far greater influence over what the House produces. The skewed proposals are unnerving some in the center-right. “I think they’re a mistake for the conference. These handful of folks want a weak speaker with a four-vote majority. The public will not like what they see of the GOP, I fear,” an unnamed House moderate told CNN.But reasonable Republicans were not obligated to be bystanders. They didn’t have to remain passive while the Freedom Caucus grabbed power from McCarthy. As GOP Rep. Don Bacon at times threatened to pursue, they could have sidelined the far right, forged a bipartisan coalition with Democrats and elected a speaker committed to raising the debt limit and keeping the government open.The partisan path Republicans took may seem the politically safer route, but can Republicans really rediscover their shared principles while the Freedom Caucus pressures the party to pursue politically dicey, scorched earth legislative tactics?House Republicans should look at the unity on the Democratic side of the aisle and consider how that materialized after a rocky two-year stretch. When Democrats were intent on passing party-line legislation through the filibuster-proof budget reconciliation process, they ended up in a protracted struggle with their most moderate members, one of which in the House (Oregon’s Kurt Schrader) was defeated in a primary and another in the Senate (Arizona’s Kyrsten Sinema) became an independent. But in 2022 after Democrats passed a slew of bipartisan bills (and one party-line reconciliation bill, reduced in size by the moderate splinter faction), they were better positioned to run on a record of accomplishment, and against an extreme conservative agenda.The GOP couldn’t be a Party of One forever, and it won’t be a Party of None forever. Republicans will eventually find their way. But America needs them to find a way that doesn’t first drag us all through an obstacle course of dumpster fires. And they are not off to a promising start.Link Copied © 2023 POLITICO LLC",https://static.politico.com/cc/d4/42715cd047ed8687deb33593b233/20230106-gop-1-francis-1.jpg,,,"The GOP is shrugging off its subservience to Trump, but with no one left to fill the void.",[''],63ba9e4c15657e93626052ef
Donald Trump,Manhattan judge wants Trump to stop calling NY attorney general's $250 million fraud case a witch hunt,"A Manhattan judge on Friday delivered his latest blow to Donald Trump, rejecting what he called the former president's ""borderline frivolous"" request to dismiss New York's $250 million fraud lawsuit, which seeks to run his business empire out of the state.In a nine-page decision, New York Supreme Court Justice Arthur Engoron kept Attorney General Letitia James' lawsuit on track for an early October trial.He stopped short of sanctioning Trump's lawyers, as he'd threatened earlier in the week, for filing what he called repeatedly rejected legal arguments — including the claim that James' three-year probe of his business and resulting lawsuit is a ""witch hunt."" As early as her 2018 campaign for attorney general, James, a Democrat, had made it clear she disagreed with the then-president's policies, and had promised to investigate and pursue fraud charges against his Manhattan-headquartered golf resort and real estate company, the Trump Organization.Trump's latest ""witch hunt'' argument — raised as part of a motion seeking the lawsuit's dismissal, is invalid, Engoron wrote Friday, because it has already failed before his court, in state appellate court, and before a federal judge last year, as the former president raised it again and again to fight the attorney general's investigatory subpoenas.In denying the motion to dismiss, Engoron rejected Trump's likewise repeatedly-rejected claims that James does not have the legal standing or capacity to sue him, and that the attorney general's allegations are too old to pursue.""Reading these arguments was, to quote the baseball sage Lawrence Peter (""Yogi"") Berra, 'Deja vu all over again,'"" the judge wrote.The judge also rejected as ""wholly unconvincing"" Trump's argument that disclaimers attached to the allegedly fraudulent financial statements sent to potential lenders — essentially warning them not to rely on his math — absolve the former president of fraud.Finally, the judge took a shot at Ivanka Trump, who has served as a Trump Organization vice president and who is named by James as a defendant, as are her brothers Eric Trump and Donald Trump, Jr., both current vice presidents at their father's company.In rejecting Ivanka Trump's separately filed motion to dismiss the lawsuit, Engoron suggested she had been less than truthful in last year's court-mandated deposition before James' legal staff.Ivanka Trump had claimed she should be removed from the lawsuit because she had stopped working for her father's business in 2017 and was not accused of personally falsifying or knowing about the falsification of any company business records.The attorney general's evidence links Ivanka Trump to years' worth of interactions with her father's longtime favorite lender, Deutsche Bank, Engoron countered in his decision. Those interactions including overseeing the financing and subsequent loan compliance for the Trump National Doral golf course in Miami and the Old Post Office in Washington, DC.""The record establishes that Ms. Trump participated far more in securing the loans than just passively receiving emails,"" Engoron wrote.""In her deposition Ms. Trump testified that she does not understand statements of financial condition and that she does not even know if they would include all assets and liabilities,"" the judge wrote. ""This is despite her communications with Deutsche Bank about SFCs,"" he wrote.Ivanka Trump further claimed she couldn't be held legally liable in the attorney general's lawsuit, but that, too, is not the case, Engoron wrote.""The record demonstrates that Ms. Trump received over $10 million in profits from the sale of the Old Post Office,"" the judge wrote.If the request for proposal for the Old Post Office was based on fraudulent statements of Trump's worth, as the attorney general alleges, then the lawsuit could result in her having to forfeit some of those profits, he wrote.""Once again, Donald Trump's attempts to evade the law have been rejected,"" James said in a statement. ""We sued Mr. Trump because we found that he engaged in years of extensive financial fraud to enrich himself and cheat the system. Today's decision makes clear that Donald Trump is not above the law and must answer for his actions in court.""""We look forward to receiving a full and proper review of our arguments on appeal,"" said Trump attorney Alina Habba. Another Trump family did not immediately respond to a request for comment.
                          Read next
                        ",https://i.insider.com/63b8d1a2d1c5130019f97da7?width=1200&format=jpeg,2023-01-06,Laura Italiano,"Trump keeps crying ""witch hunt"" over NY Attorney General Letitia James' fraud accusations. Friday, a Manhattan judge turned him down yet again.","['Letitia James', ' Donald Trump', ' Ivanka Trump', ' Laura Italiano']",63ba9e4d15657e93626052f0
